category,doc_title
health,"the uk has now overtaken italy to have the highest number of officially recorded coronavirus deaths in europe.  the figures - announced by both governments daily - show a total of 29,427 deaths in the uk and 29,315 in italy.  but can you make a fair comparison between the two countries?  there are challenges around doing this at the moment and here are some of the factors to take into account.  1. population sizes  for a start, the uk's population is roughly 66 million, and italy's is about 60 million.  so the uk would have to register at least 10% more deaths than italy for it to have a higher death rate per person.  given that italy is further past the peak of the outbreak, and is now recording significantly fewer deaths per day than the uk, that may well happen.     2. the two countries may not be counting the same way  the different ways different countries count deaths also need to be considered.  ""every country measures deaths in a different way,"" the uk government's chief medical adviser chris whitty said at one daily briefing, ""so comparing them to each other is a largely fruitless exercise"".  on the face of it, italy and the uk now do it in fairly similar ways - only including confirmed covid-19 cases in their cumulative daily counts.  but while it is safe to assume the figures for the numbers of deaths in hospitals are fairly accurate, can the same be said about deaths in care homes or at home?  there is no national figure in italy for deaths in care homes - the numbers are collated on a regional basis and slightly different measures are being used in different parts of the country.  but, says eleonora perobelli, a researcher at the observatory on long term care in milan, ""the vast majority of officially confirmed covid-19 related deaths are registered in hospitals"".  we do know that the uk figures as of 5 may include more than 4,600 people who died ""in a community setting'""- in other words outside hospital. we also know that there were relatively few tests carried out in care homes until recently.  but in italy, we simply don't know how many of the italian deaths may have occurred outside hospital.  so it is difficult in this case to be confident that we really are comparing like with like.     3. testing  given that the daily figures released by both governments are for people who have died after testing positive for coronavirus, how much testing is going on is clearly important.  to use an extreme example, if neither country had tested any people at all, nobody would have died after testing positive. on the other hand, if everybody in the country had been tested the deaths figure would have been much higher.  the uk is currently testing more people per day than italy, but overall italy, which has been in lockdown longer, has carried out more than 2.2 million tests as of 5 may while the uk has done over 1.3 million.  for daily figures that are based on people who have tested positive for the virus, that is a crucial distinction, which makes comparing the figures problematic.     4. what is the age and health of the population?  the most useful comparison to make between two countries looks at the total number of deaths from all causes adjusted for age.  why would you adjust for age?  we know that coronavirus affects older people more severely than younger people. older people are much more likely to have the underlying health conditions that make coronavirus so much more dangerous.  in the uk for example, in the week to 24 april, we know that coronavirus killed:  four per 100,000 people under the age of 75  75 per 100,000 of the 75-84 group  242 per 100,000 people over 85  italy has fewer young people and more old people percentage of population in three age groups  italy has a higher proportion of older people and a smaller proportion of children (who are much less likely to be severely affected) so, if all other factors were equal, you would expect more coronavirus deaths in italy than the uk.  the other thing you might want to adjust for would be the overall health of the population, which would be relevant for how many people you would expect to die in a given period.  this is usually expressed by giving the number of excess deaths. if you were looking for the number of excess deaths in april, for example, it would be the number of people who have died minus the average number of deaths in april over the previous five years.  it is important to compare with the same period in previous years because we expect more people to die in winter than in summer.  in italy, from 20 february when the first coronavirus death was reported until the end of march, there were 90,946 deaths from all causes, compared with the average of 65,592 for the previous five years - that's an excess of 25,354 deaths.  it would be best to compare that with the six-week period after the first coronavirus death in the uk. the excess deaths figures are published weekly by the ons.  you could take the six weeks starting with the week to 6 march, because that is when the first death occurred. if you do that then you find that 89,735 people died from all causes in the uk, compared with an average of 72,812 in the same period of the previous five years, which is an excess of 16,923.  but you could also start a week later, which is when the first death was registered and so appears in the ons figures. if you do that you get a figure of almost 30,000 excess deaths.  so it is probably too early to make this comparison - it currently only appears to be a measure of how fast the virus spread. given another month of extra data for italy we might be able to make a meaningful comparison.     5. what about population density and other factors?  other factors surrounding the disease - the epidemiology - also have to be taken into account.  it's not just about the size of your population.  you also have to take account of the way that population is distributed around the country, and of relevant characteristics such as underlying health conditions.  we know that the density of population is important for the spreading of coronavirus - it's much more difficult to keep your distance in a crowded area.  overall, the uk is considerably more densely populated, with about 275 people per sq km compared with about 205 in italy.  and the most crowded part of the uk is london, which is western europe's largest and most global city. it's hardly surprising that it has been one of the epicentres of this outbreak.  but if london (population roughly nine million) has been the worst hit region in the uk, then lombardy (population roughly 10 million and more widely dispersed) has been the worst hit region in italy.  figures from the italian statistics agency istat show just how bad things have been in parts of northern italy. deaths in lombardy during march 2020 were 186.5% above the five-year average for that time of year, and in the specific area around the city of bergamo they were 567.6% above the average.  that's higher than in london, and helps explain why the shocking scenes of overcrowding that were seen in some italian hospitals have not been replicated in london hospitals.  but it's also worth emphasising that the virus hit northern italy before it hit the uk, and lombardy had less time to prepare. in parts of southern italy, the number of deaths recorded this year is actually below the five year average.  this piece was originally published on 5 may. it has been updated to add another excess deaths figure.  what claims do you want bbc reality check to investigate? get in touch  read more from reality check  follow us on twitter"
health,"the government has come under pressure from mps and businesses to relax the 2m (6ft) rule for social distancing, to make it easier for people to return to work.  but scientists continue to question whether that would be safe, given how little is known about how far coronavirus can spread.  what does the science say?  the simple answer is that the closer you are to someone who is infected, the greater the risk of catching the virus.  the world health organization says that a distance of 1m is safe. some countries have adopted this guidance, while others, including the uk, have gone further:  1m distancing rule - china, denmark, france, hong kong, lithuania, singapore  1.4m - south korea  1.5m - australia, belgium, germany, greece, italy, netherlands, portugal  1.8m - us  2m - canada, spain, uk  media playback is unsupported on your device media caption the uk government is advising us to stay two metres apart - but what does that look like?  it's not just about distance  timing is also key. the longer you spend in close proximity with an infected person, the bigger the risk.  scientists advising the uk government say that spending six seconds at a distance of 1m from someone is the same as spending one minute at a distance of 2m.  being exposed to someone coughing is riskier. being 2m away from a cough carries the same risk as someone talking to you for 30 minutes at the same distance.  what's the latest research?  in a study published in the medical journal the lancet, scientists evaluated recent research into how the coronavirus can spread.  they conclude that keeping at least 1m from other people could be the best way to limit the chances of infection.  the risk of being infected is estimated to be 13% within 1m, but only 3% beyond that distance.  and the study says that for every extra metre of distance up to 3m, the risk is further reduced by half.  where does the distancing rule come from?  it can be traced back to research in the 1930s.  scientists found that droplets of liquid released by coughs or sneezes evaporate quickly in the air or fall to the ground.  most of those droplets, they reckoned, would land within 1-2m.  that is why it is said the greatest risks come from having the virus coughed at you from close range, or from touching a surface that someone coughed onto, and then touching your face.     can the virus travel further in other ways?  many scientists regard closeness and surface contacts as the main routes of transmission.  but some researchers are concerned that the coronavirus can also be transported through the air in tiny particles called aerosols.  if that is the case, then the flow of wind from someone's breath could carry the virus over longer distances.  professor lydia bourouiba from the massachusetts institute of technology (mit) used high-speed cameras to capture a cough projecting miniature specks as far as 6m.  and a study carried out at hospitals in china, which found traces of coronavirus in covid-19 wards and intensive care units, estimated that 4m was a better safe distance.  but for the us centers for disease control, the role of aerosols in spreading the virus is ""currently uncertain"".  and what's still not known is whether any virus that spreads further than 2m can still be infectious.  what else makes a difference?  there is wide agreement that the infection is more easily passed on indoors than outside in the fresh air.  japanese researchers investigated 110 cases of covid-19, following up the contacts of the people infected.  they estimated that the odds of the infection being passed on were nearly 19 times greater indoors than when outside.  in many countries, including england and scotland, people are being encouraged to wear face coverings on public transport and ""enclosed spaces where social distancing is not always possible"".     why don't we have definite answers?  it is only a few months since the coronavirus emerged and in that short time scientists have learned a great deal about it.  but there is a long way to go and confirming exactly the right distance is one of the unanswered questions.  it will take careful studies of how the virus can be carried, and how viable it remains, which will all take time."
health,"st george's hospital  dr nigel kennea trained as a doctor for newborn babies and is now focused on helping the bereaved  when dr nigel kennea talks of the ""unexpectedness and awfulness"" of deaths in his hospital in the past six weeks, he tempers it with a positive focus on helping bereaved families left behind.  as a medical examiner at st george's hospital, in south london, his job is to advise clinical teams on completing death certificates, then support relatives through their grief.  but like so much during this pandemic, none of that is straightforward.  ""the most harrowing thing is knowing that many said goodbye to their loved ones in an ambulance,"" he says.  despite staff ""going above and beyond"" to support patients in desperate times, using mobile phones and ipads to connect seriously ill patients and their families, contact is just not always possible.  even after a patient's death, social distancing has meant grieving relatives are left in limbo.  ""normally, registering a death is done face-to-face with relatives,"" dr kennea says.  ""they come in, talk through the admin and how to plan for after death.  ""now, it's all done on the phone.""  'share the burden'  dr kennea's job is to take an overview of all deaths at the hospital. it's a relatively new role in the uk, introduced last year, which is independent of trusts.  previously he was a specialist in the care of newborn babies.  now, dr kennea discusses each death at the hospital with the doctors and nurses involved in that patient's care, making sure death certificates are completed correctly and consistently.     with covid-19 deaths so closely scrutinised, there is added pressure and ""some are complicated"", he says.  there is still so much doctors are learning about the virus and its effects on people's bodies - such as heart failure, thrombosis, kidney problems and pneumonia.  but, dr kennea says: ""if a test for coronavirus has been carried out and is positive, that goes on the death certificate as it is likely to have contributed to the death.""  and the hospital aims to report these deaths to national bodies on the day they happen.  although those that seem unnatural or have no certain cause must be referred to a coroner.  but the role he is most proud of is supporting bereaved families - talking to them about what is on the certificate, the care the patient received and next steps for the funeral.  ""we share the burden together,"" he says.  'human touch'  these conversations with families are when life stories are told and memories shared. there is often laughter too.  and there is now more demand than ever for hospitals to have good communication skills and show sensitivity towards families.  ""we are better at this than we were six weeks ago,"" dr kennea says.   st george's hospital  dr kennea and the medical examiner team contact families after a death  ""so many people are so grateful for our support.  ""and they often say they appreciated the human touch,"" he says.  st george's hospital had its first covid-19 death on 12 march.  since then, 250 people have died with the illness at the hospital, while more than 600 have recovered and been discharged.  in the worst week, 60 patients died with covid-19.  by turning normal wards into intensive care units and training up staff to work there, this large hospital has coped through all the turmoil.  and it has even been able to take covid-19 patients needing dialysis from other london hospitals.  but there has been immense pressure on front-line staff, kitted out in personal protective equipment day in, day out.  when dr kennea goes into covid-19 areas, he too wears full ppe - but it has its limits when communicating with patients.  ""it's hard to share a smile behind a mask and goggles,"" he says.  'violent tragedy'  now, 60 patients with covid-19 are being ventilated in the hospital's intensive care unit.  at the peak, it was 120.  there is a sense the situation is improving and that is ""really gratifying"", dr kennea says.  yet there is so much from the past few months he will never forget.  he has marvelled at human powers of recovery - sometimes in the most unexpected places, such as among the very elderly.  but at the same time, he has seen younger people whose lives have been cruelly taken.  ""it is just a violent tragedy,"" he says.  ""it is such an exceptional time for lives being snatched away."""
politics,ukip could sue veritas defectors the uk independence party could take legal action to unseat two london assembly members who defected to robert kilroy silk s veritas party.  damian hockney  now veritas deputy leader  and peter hulme-cross were elected in 2004 on the list system. the party argues the pair should give up their seats as they won them as ukip representatives  not as individuals. mr hockney said the law was clear that those elected on a list who quit their party should keep their seats. ukip chairman petrina holdsworth urged the men to step down from the gla in a letter.  she said:  the party has taken legal advice and it is clear that we could take legal proceedings against you which could result in the return of our seats and/or damages against you.  we would however like you to be given an opportunity to reflect on what you have done  to restore your own credibility with the electorate and return the seats to the party which won them fair and square at the last election.  mr hockney said the law worked in exactly the same way for the gla as it did for other electoral list systems.  the greater london act is clear that if someone resigns who was elected on a list  their party whip the seat belongs to them and not the party.  he said mr hulme-cross and himself had no intention of resigning and added that they felt that it was ukip who were not being true to the electorate. he accused the party of signing up to a deal with the tories in europe  rather than sticking to an independent stance. but the claim was denied by ukip spokesman  who said:  mr hockney s accusations are like his sense of political morals - empty.  veritas was formed by mr kilroy-silk earlier this month after he quit ukip following an unsuccessful bid to take over as leader.
politics,talks aim to avert pension strike talks aimed at averting a series of national strikes over pensions reforms will take place this weekend.  five public sector unions will hold private talks with deputy prime minister john prescott at labour s spring conference in gateshead. they want the government to withdraw regulations - due to be introduced in weeks - which would raise the pension age for council workers from 60 to 65. up to 1.4m workers could take part in a strike already earmarked for 23 march. however  all sides are anxious to avoid a major confrontation in the run up to the general election  said bbc labour affairs correspondent stephen cape. in four days  britain s biggest union unison will start balloting 800 000 local government workers on strikes. other public sector unions have pledged to follow. it is just weeks before new regulations are introduced to raise the pension age of local government workers.  the five unions meeting mr prescott want the government to withdraw these regulations. this would allow months of tough negotiations to follow  said our correspondent. but a spokesman for mr prescott warned that the changes to the local government pension scheme would have to go ahead in april. privately ministers believe this will be the  less painful  option  our correspondent added. the public and commercial services union (pcs) will co-ordinate any industrial action with up to six other public sector unions. pcs leader mark serwotka warned last week that there could be further walkouts unless there was a government rethink.  for a government that lectures everyone on choice - choice on public service  choice on this and choice on that - isn t it ironic that they re saying to public sector workers there is no choice   he said.  if you want the pension you were promised when you started you must work for an extra five years - that is working until people drop.  in the 20th century  it s completely unacceptable.   unison s 800 000 workers  the transport and general workers  union s 70 000 and amicus  20 000 are among those being balloted about a 23 march walkout. mr prescott held a private meeting with senior union figures last week. it is understood no deal was offered in that meeting but there was room for further negotiations.
sport,federer claims dubai crown world number one roger federer added the dubai championship trophy to his long list of successes - but not before he was given a test by ivan ljubicic.  top seed federer looked to be on course for a easy victory when he thumped the eighth seed 6-1 in the first set. but ljubicic  who beat tim henman in the last eight  dug deep to secure the second set after a tense tiebreak. swiss star federer was not about to lose his cool  though  turning on the style to win the deciding set 6-3. the match was a re-run of last week s final at the world indoor tournament in rotterdam  where federer triumphed  but not until ljubicic had stretched him for five sets.  i really wanted to get off to a good start this time  and i did  and i could really play with confidence while he still looking for his rhythm   federer said.   that took me all the way through to 6-1 3-1 0-30 on his serve and i almost ran away with it. but he came back  and that was a good effort on his side.  ljubicic was at a loss to explain his poor showing in the first set.  i didn t start badly  but then suddenly i felt like my racket was loose and the balls were flying a little bit too much. and with roger  if you relax for a second it just goes very quick   he said.  after those first three games it was no match at all. i don t know  it was really weird. i was playing really well the whole year  and then suddenly i found myself in trouble just to put the ball in the court.  but despite his defeat  the world number 14 was pleased with his overall performance.  i had a chance in the third  and for me it s really positive to twice in two weeks have a chance against roger to win the match.  it s an absolutely great boost to my confidence that i m up there and belong with top-class players.
sport,calder fears for scottish rugby former scotland international finlay calder fears civil war at the sru could seriously hamper his country s rbs six nations campaign.  four members of the executive board  including the chairman  david mackay  have resigned after a simmering row. and calder said:  this is terrible news for every level of scottish rugby.  david is a successful businessman and i thought that if anybody could transform the negative atmosphere and rising debt level  it was him.  mackay s executive board has been in a power struggle with the general committee  which contains members elected by scotland s club sides.  he has been driven out by people who seem happier waging civil war than addressing the central issue that professional rugby can t be run by amateurs   said calder.   in fact  i don t understand why we are still having this argument 10 years after professionalism arrived.  but i don t believe the rest of the sru will take this lying down.  i think the banks will be dismayed at this decision and  ultimately  it is them who pull the strings.  so i wouldn t be surprised if they reviewed their position. but  in the wider picture  what message does this send out   he thought the work of scotland s coaches  who have been attempting to arrest the decline of the national side  would be made much more difficult.  matt williams and willie anderson must be wondering   what have we walked into here    said calder.  and we can now expect weeks of arguments and acrimony just at a time when we should be looking forward to the six nations championship.  i am very  very disappointed  more than you can imagine. why do so many scots have this knack of turning on each other when the going gets tough
