category,doc_title
Sports,Alessia Russo: The England super sub who is making her name at Euro 2022 : It says a lot about Alessia Russo's rise that she has not started a game for England at Euro 2022 but she was the name on everyone's lips after the Lionesses' semi-final win over Sweden.
Sports,European Championships: Dina Asher-Smith in Great Britain squad despite injury : The British sprinter withdrew from the Commonwealth Games after suffering an injury at the World Championships.
Health,"spatial correlation between malaria cases and water-bodies in anopheles sinensis dominated areas of huang-huai plain, china : malaria re-emerged in the huang-huai plain of central china during 2006–2008, dominated with anopheles sinensis as a vector. however, there is no information on strategies based on multi-factor analysis to effectively control the re-emergence of malaria in these areas. previous experience indicates some relationship between the distribution of water bodies and malaria cases, but more detailed data are not available and in-depth studies have not been conducted up to now. the objective of this study was to identify the relationship between the distribution of water bodies and presentation of malaria cases using spatial analysis tools in order to provide guidance to help formulate effective strategies for use in controlling the sources of malaria infection, based on the identification of risk areas and population. the geographic information of malaria cases and their surrounding water bodies were collected from suixi, guoyang, guzhen, yingshang, fengyang and yongqiao county in anhui province, yongcheng and tongbai county in henan province. all malaria cases distributed in 113 villages in these 8 counties were collected from the china information system for disease control and prevention and confirmed by household investigation. data on gis and malaria cases were mapped and analyzed with the software of arcgis 9.2 to identify the spatial correlation between malaria cases and water bodies. the distance from households with malaria cases to the nearest water bodies was used to calculate the or value by chi-square test. the risk area was identified through the comparison of or values in different distances. 357 malaria cases and …"
Politics,"Defence Secretary Ben Wallace endorses Liz Truss for PM : Ms Truss's leadership rival Rishi Sunak said he was ""winning round"" Conservative Party members ahead of ballots going out next week."
Sports,"Crawley Town: The 'internet's football team' aiming for the Premier League : They describe themselves as ""the internet's football team"" and have ambitions to reach the Premier League by reinventing what they call the ""broken"", ""legacy"" model of club management."
Sports,"Afghanistan women's team: They escaped the Taliban but face uncertain football future : The scene at Kabul airport was one of chaos and desperation. Amid gunfire, people were stampeding in total panic. Thousands were trying to escape the Taliban, and Fati was among them."
Politics,"Tory leadership latest: Sunak says yes to return of grammar schools ; Conservative leadership candidate Rishi Sunak has said he would back the return of grammar schools, during a hustings with rival Liz Truss."
Politics,"Foreign Office 'regrets' Afghanistan Nowzad animal charity row : The Foreign Office has said it ""regrets"" the time taken to establish the decision-making process behind the controversial evacuation of animal welfare charity staff from Afghanistan."
Health,"online elearning for undergraduates in health professions: a systematic review of the impact on knowledge, skills, attitudes and satisfaction : background"
Health,"prediagnostic 25-hydroxyvitamin d, vdr and casr polymorphisms, and survival in patients with colorectal cancer in western european populations : background:"
Politics,"Sam Tarry fired for making up policy on the hoof, says Keir Starmer: Sir Keir Starmer says he sacked his transport spokesman Sam Tarry for doing interviews ""without permission"" and ""making up policy on the hoof""."
Health,"Infected blood victims set for pounds 400m in compensation : More than 4,000 surviving victims of the contaminated blood scandal should receive provisional compensation of pounds 100,000 each, a judge has said."
Health,"consumers and food security: uncertain or empowered? : provoked by concerns about climate change, resource depletion and economic recession, the concept of food security has experienced a renaissance in international policy and research agendas. despite this interest, the problem of food insecurity in wealthy countries has still not received enough attention. we argue that it is worthy of research and policy focus, because by examining the experiences and perceptions of food security amongst the 'global rich', we can develop more critical understandings of the implications of neoliberal constructions of the consumer as a driving force in moves towards more secure food systems. the paper draws on empirical data from shoppers in the united kingdom to make three key arguments. first, it is important to retain the issue of economic access to food at the heart of discussions of food security, so that the concept is not reduced to the problem of how to increase …"
Health,"imaging assessments of patients with suspected systemic sclerosis and associated inflammatory lung disease : patients with ssc, also known as scleroderma, experience significant morbidity and mortality [1, 2]. hallmarks of ssc include inflammation, tissue fibrosis, production of certain antibodies and impaired microvascular perfusion. an early diagnosis helps to implement the most appropriate therapy for each patient and thus improve quality of life and survival. some patients can also have linked ild and this also needs careful assessment to stage the severity of disease."
health,"senior conservative mps are urging boris johnson to consider changing the 2m social distancing rule to 1.5m, amid fears for the hospitality sector.  greg clark, chair of the commons science committee, told the daily telegraph it could ""be the difference between people being able to go to work and losing their jobs"".  former chancellor lord lamont said measures which could ""compensate"", such as face masks, should be considered.  other countries have different rules.  while some lockdown measures are being eased across the uk, the social distancing rules, which say people from different households should stay 2m (6ft 6ins) apart from each other, still apply.  however, former business secretary mr clark wrote to the prime minister asking for sage (scientific advisory group for emergencies) to review the rule.  even if sage did not recommend reducing the distance, it would be important for it to ""clarify the rationale"" behind 2m and explain ""why the guidance in the uk differs from so many international comparators,"" mr clark said.  france and italy say people should keep 1m (3ft) apart, as does the world health organization. germany recommends a distance of 1.5m (4ft 11ins), while spain, like the uk, has a 2m rule.  the us advises to keep 6ft apart.  on thursday, england's chief medical officer professor chris whitty reiterated that it was ""really important"" that people stayed 2m away from each other.  speaking to bbc radio 4's today programme, lord lamont called on the advice to be re-examined, saying social distancing was causing ""huge problems"" for the hospitality sector.  ""if you want a single measure that could help the hospitality sector, it would be a reduction in the social distancing from 2m to 1m,"" the tory peer said, but insisted he would not want the government to ""ignore"" scientific and medical advice.  his comments come days after kate nicholls, chief executive of uk hospitality, called for the distance to be reduced even further, to 1m (3ft 4ins).  she said: ""if you have 2m social distancing that's the difference between opening at 30% of normal revenues or 60% with 1m social distancing.""  what does the science say about the 2m rule?  a simple guide is that the closer you are to someone who is infected, the greater the risk.  also the longer a person spends in close proximity with an infected person, the more the chance of catching the virus increases.  sage reported that being exposed for six seconds at 1m is comparable to a one-minute exposure at 2m.  in its latest paper on the issue, from april, it recommends keeping the rule, saying 2m is a ""good measure"" of the distance where the direct person-to-person transmission risk drops significantly.  but it says it should be seen as a ballpark guide to distancing rather than an absolute value.  read more on the science behind the 2m rule here.  former brexit secretary david davis said changes to the government's furlough scheme should be implemented ""in-step"" with a relaxation of the 2m rule.  the government is currently paying 80% of the salaries of 8.4 million uk workers - up to £2,500 a month - but from august, employers will have to start sharing the cost.  however mr davis said some firms would be unfairly disadvantaged if they had to shut because they could not social distance, while being forced to start paying towards staff costs again.  speaking on thursday, mr johnson said: ""i must stress that to control the virus, everyone needs to stay alert, act responsibly, strictly observe social distancing rules, and stay 2m apart from those who you do not live with."""
health,"as the crisis has unfolded, scientists have discovered more evidence about a strange and worrying feature of the coronavirus. while many people who become infected develop a cough, fever and loss of taste and smell, others have no symptoms at all and never realise they're carrying covid-19.  researchers say it's vital to understand how many are affected this way and whether ""silent spreaders"" are fuelling the pandemic.  when people gathered at a church in singapore on 19 january, no-one could have realised that the event would have global implications for the spread of coronavirus. it was a sunday and, as usual, one of the services was being conducted in mandarin. among the congregation at the life church and missions, on the ground floor of an office building, was a couple, both aged 56, who'd arrived that morning from china.  as they took their seats, they seemed perfectly healthy so there was no reason to think they might be carrying the virus. at that time, a persistent cough was understood to be the most distinctive feature of covid-19 and it was seen as the most likely way to transmit it. having no symptoms of the disease should have meant having no chance of spreading it.  the couple left as soon as the service was over. but shortly afterwards, things took a turn for the worse, and in a wholly confusing way. the wife started to become ill on january 22, followed by her husband two days later. because they had flown in from wuhan, the epicentre of the outbreak, that was no big surprise.  but over the following week, three local people also came down with the disease for no obvious reason, leading to one of singapore's first and most baffling coronavirus cases. working out what had happened would lead to a new and disturbing insight into how the virus was so successfully finding new victims.  mobilising 'disease detectives'  ""we were extremely perplexed,"" says dr vernon lee, head of communicable diseases at singapore's ministry of health. ""people who didn't know one another somehow infected each other,"" while showing no sign of illness. this new batch of cases simply did not make sense, according to what was known about covid-19 back then.  so dr lee and his fellow scientists, along with police officers and specialist disease trackers, launched an investigation, generating detailed maps showing who was where and when. this involved the very best of the process known as contact tracing - a version of which is getting under way now in the uk. it's seen as a vital system for tracking down everyone involved in an outbreak and helping to stamp it out, and singapore is renowned for the skill and speed with which this is carried out.     early in the pandemic, singapore was seen as a shining example of how to tackle the virus  amazingly, within a few days, investigators had spoken to no fewer than 191 members of the church and had found out that 142 of them had been there that sunday. they quickly established that two of the singaporeans who became infected had been at the same service as the chinese couple.  ""they could have spoken to each other, greeted each other, during the usual activities of a church service,"" says dr lee.  that was a useful start and would explain in theory how the infection could have been passed on, apart from one key factor. it did not answer the crucial question of how the virus could have been transmitted by the two chinese people when at that stage they had shown no indication of having the disease.  and on top of that was an even greater puzzle. it was confirmed that the third singaporean to become infected, a 52-year-old woman, had not been at the same service as the others. instead she had attended another event in the same church later that day, so how could she have picked up the virus?  evidence no-one expected  investigators resorted to going through the cctv recordings made at the church that sunday to search for clues. and they stumbled across something completely unexpected - the woman who'd attended the later service, after the chinese couple had left, had sat in the seats they had used several hours earlier.  somehow, despite having no symptoms and not feeling ill, the chinese husband and wife had managed to spread the virus. maybe they'd had it on their hands and touched the seats, maybe their breath carried the infection and it landed on a surface, it's not clear, but the implications were huge.  for dr lee, piecing everything together, there was only one possible explanation - that the virus was being passed by people who had it without even realising. this was a revelation that would be relevant the world over because the central message of all public health advice on coronavirus has always been to look out for symptoms in yourself and others.  but if the virus was also being spread by people without symptoms, silently and invisibly, how could the disease be stopped? he remembers the moment, while working in his office, when the reality dawned on him. ""every time you make a scientific discovery, it is like a 'eureka' moment when you realise that this is something important that you've uncovered, through the hard work of many individuals and teams.""  spread before symptoms show  what was revealed was what's known as ""pre-symptomatic transmission"" where someone is unaware of being infected because the cough, fever and other classic symptoms have yet to begin.     singapore saw a rise in cases after appearing to have the virus under control  along with many others, this study highlighted a critical period of 24-to-48 hours before the visible onset of the disease in which people can be highly infectious, perhaps even their most infectious.  being aware of that is potentially invaluable, because as soon as you realise you're ill then everyone you've been in close contact with can be warned to stay at home.  that would mean that they would be isolating during the key phase of infection before their own symptoms start. but exactly how the disease can be transmitted without a cough to project droplets containing the virus is still open to debate.  one option is that simply breathing or talking to someone can do the job. if the virus is reproducing in the upper respiratory tract at that time then it's possible that some of it will emerge with each exhalation. anyone close enough, especially indoors, could easily pick it up.  and another potential form of transmission is by touch - the virus gets onto someone's hands and they touch another person or a door handle - or a seat in a church. whatever the route, the virus is clearly exploiting the fact that people are bound to be less vigilant if they're not aware that they might be infected.  some people never show symptoms  this is an even more mysterious scenario, and one that scientists simply have no definitive answer to. it's one thing to know that people can be infectious before their symptoms show, quite another when they become infected but never have any sign of it.  this is what's known as being ""asymptomatic"" because you are a carrier of the disease but do not suffer in any way yourself. the most famous case is that of an irish woman who was working as a cook in new york at the beginning of the last century.     wherever mary mallon was employed, in house after house, people became ill with typhoid and at least three, maybe many more, died of it, but she was completely unaffected. eventually a connection was established and it was confirmed that she was the unwitting spreader of the disease.  reporters dubbed her ""typhoid mary"", a label she always resented, but the authorities took no chances and kept her in confinement for 23 years until her death in 1938.  assumptions undermined  staff nurse amelia powell was shocked when she found out that she is asymptomatic. she was at work on her hospital ward at addenbrooke's hospital in cambridge in april when a doctor rang to give her the result of a swab test.  she had been feeling normal and safe behind the personal protective equipment she had to wear while caring for patients with covid-19. but suddenly all those assumptions were undermined because, to her horror, she had tested positive.  ""it was a bit like hearing that someone in the family had passed, it was surreal. ""i thought, 'this can't be right, not me, i'm absolutely fine,'"" says 23-year-old amelia.  she had to leave her post straightaway to go into isolation at home.  ""i was worried because i've seen the other side, with patients deteriorating very quickly with it, so i did wonder if this would happen to me."" but, to her surprise, at no point did she feel unwell. ""i had nothing, literally - i was exercising indoors, eating normally, sleeping normally.""  at the moment it's impossible to know how many cases of infection exist but remain hidden from view.  the discovery that amelia was infected was only revealed because she was part of a study of all the staff at her hospital. it produced the surprising result that as many as 3% of more than 1,000 people were positive while showing no symptoms at the time of the test.  an even greater proportion of asymptomatic cases was found on the diamond princess cruise ship which had been sailing off the coast of japan earlier this year. later branded ""a petri dish for infection"", it had around 700 cases.  researchers found that three quarters of the people who had tested positive had no symptoms.  and at a care home in washington state more than half the residents were positive but had no sign of the illness.  'no single reliable study'  different studies suggest a huge range of possibilities for how many cases are asymptomatic stretching from 5% to 80% of cases. that was the conclusion of an analysis by prof carl heneghan of the university of oxford and colleagues who looked at 21 research projects.  the upshot, they said, was that ""there is not a single reliable study to determine the number of asymptomatics"". and they said that if the screening for covid-19 is only carried out on people with symptoms - which has been the main focus of uk testing policy - then cases will be missed, ""perhaps a lot of cases"".  the risk of 'silent spreaders'  the biggest concern of amelia, the nurse, was that she might have unwittingly transmitted the virus either to those she works with or to the patients who depend on her help.  ""i don't think i passed it on because all the colleagues i work with tested negative but it was worrying to think how long i'd been positive for,"" she says. ""but we still don't know if people who are asymptomatic are contagious or not - it's very bizarre and the information about it at the moment is minimal.""  one study in china which found that the number of asymptomatic cases was actually greater than those with symptoms had a warning for the authorities. ""as 'silent spreaders',"" the scientists wrote, ""asymptomatic carriers warrant attention as part of disease prevention and control.""     the team that studied that diamond princess reckoned that asymptomatic cases were likely to be less infectious than people with symptoms but even so they're estimated to have caused a significant number of cases.  the 'dark matter' of asymptomatic infection  to try to get an answer, scientists in norwich are pushing for the population of the entire city to be tested.  ""asymptomatic cases may be the 'dark matter' of the epidemic,"" according to prof neil hall, head of the earlham institute, a life science research centre, who's leading the initiative. dark matter is the invisible substance believed to make up most of the matter in the universe, and it's yet to be identified.  prof hall worries that asymptomatic cases may actually be driving the pandemic, keeping it going despite public health measures. ""if you have people who don't know they're ill while using public transport and health care facilities, inevitably that's going to increase transmission,"" he says.  ""any intervention that's only based on people coming to primary health care when they have symptoms will only deal with half the problem.""  a team of scientists in california believes that not knowing who's carrying the virus without symptoms is the ""achilles heel"" of the fight against the pandemic.     china launched a mass testing programme in wuhan  in their view, the only way to stop the disease from spreading is to find out who's infected regardless of whether they think they are or not. that was also the recommendation of mps on the commons science and technology committee in a letter to the prime minister boris johnson.  they wrote that the risk of asymptomatic transmission has ""a profound consequence for the management of the pandemic"". and they said that anyone looking after vulnerable people - such as health workers or care workers - should be given regular testing.  a similar approach is being adopted on a far larger scale in the chinese city of wuhan, where the pandemic is thought to have begun.  as many as 6.5 million people there were tested in as little as nine days in a mass screening programme designed to detect the disease - including in those showing no symptoms.  easing of lockdown  as lockdown measures are eased and more people start to use public transport, return to work or go shopping, getting to grips with the invisible risk matters more than ever. at the moment, there is no way of telling who among the growing crowds may be carrying the virus without knowing.  that's why governments the world over say it's essential that everyone cooperates with efforts to trace the contacts of anyone infected and then quickly self-isolates. they also advise that the best defence remains social distancing - to keep apart wherever you can. but where that isn't possible, the recommendation is to cover your face, even with a mask that's homemade.     more and more governments are advising wearing face masks  when the us government announced this policy, it highlighted the discoveries made in the church in singapore back in january. the logic is that this is not about protecting yourself, it's about protecting others from you, in case you're infected but don't know it.  many health professionals worry that masks might distract people from hand washing or social distancing, or increase the risk of contamination if they're clumsily handled. but more and more governments, most recently that of the uk, have become convinced of the benefits.  not that face coverings will halt the pandemic on their own. but because there's still so little we know about asymptomatic transmission, almost anything is worth a try.  you may also be interested in:  when you talk to intensive care doctors across the uk, exhausted after weeks of dealing with the ravages of covid-19, one phrase emerges time after time: ""we've never seen anything like this before.""  they knew a new disease was coming, and they were expecting resources to be stretched by an unknown respiratory infection which had first appeared in china at the end of last year.  ""it felt in some ways like we were trying to prepare for the d-day landings,"" says barbara miles, clinical director of intensive care at glasgow royal infirmary, ""with three weeks to get ready and not a great deal of knowledge about what we would be facing"".  read a summary, often in their own words, of what doctors have learnt about how covid-19 attacks the human body."
