category,doc_title
sport,tevez - an argentine in brazil some 65 years ago bernardo gandulla left boca juniors in his native argentina and headed for brazil.  he arrived at the vasco da gama club with considerable prestige - which he failed to live up to. he left an impression  but not for reasons he would have wanted. the only thing of note he did was to throw the ball back when it went out of play. even today   gandula  is the term used in brazil for ballboy. brazilians delighted in the failure of gandulla then  and many will delight now if history is repeated. another boca juniors player is coming to brazil.  the new maradona  - carlos tevez - is joining corinthians for nearly $20m in a strong candidate for the strangest move of the year. corinthians - or the london-based company who have just entered into partnership with them - appear to have paid well above the odds for tevez. it is particularly strange as - until last week - tevez was not even an especially big name in brazil  where the argentine championship is not shown.  presumably there is some financial logic behind the move. what is harder to work out is why tevez should be interested in heading north  rather than across the atlantic. argentina s brightest new star hit top form in august as he spearheaded the charge towards the olympic gold medal. but the subsequent months have not been easy for tevez. boca re-signed martin palermo  forcing tevez to vacate his favoured centre forward role. and off the pitch he gave the press plenty to report - atletico madrid gave up on him after declaring his private life to be  disorganized.  hounded by the press  tevez grew tired of his life in buenos aires. so now he says that he is heading for corinthians in search of  tranquillity.  anyone acquainted with the city of s&#227;o paulo will relish the nonsense of this declaration. brazil s biggest city is a sprawling  ugly  restless metropolis. once it shared with buenos aires the same melancholy air of a city of italian immigrants.  but that world now lies buried under skyscrapers. the most turbulent place in this frenetic city is sport club corinthians. it is the most passionately supported club in brazil. pel&#233; scored reams of goals against them  reasoning that unless he did something special the corinthians fans were capable of winning the game on their own. that passion can also be turned against the team - especially nowadays  when the level of urban violence gives a hysterical edge to life in brazil s big cities. corinthians fans have invaded the dressing room or ambushed the team coach to attack the players. tevez  then  can kiss tranquillity goodbye. he can also say farewell to the copa libertadores  south america s champions league. corinthians have not qualified. indeed  he will have a long wait for a worthwhile match. next year s brazilian championship only gets underway at the end of april. until then he will have to make do with the foolish s&#227;o paulo state championship  an appalling waste of his talent. there will be matches in small towns on poor pitches with plenty of defenders keen to kick him all the way back to argentina. like so many of the top south american players  tevez has the gift of being able to surprise - to feint right and go left  to pass when he was expected to dribble  to shoot and catch the goalkeeper unawares. but his choice of destination is the biggest surprise of all.
sport,curbishley delight for johansson charlton manager alan curbishley paid tribute to two-goal striker jonatan johansson after beating norwich.  curbishley said after the 4-0 win:  there was talk about norwich being interested in the summer but i have a lot of faith in jonatan.  when there was talk of other clubs i just told him he was going nowhere.  he s part of our squad and he got us a couple of important goals early on. i m sure he s happy here  but i was delighted with all the players.  curbishley was subjected to criticism from charlton fans recently  and he said:  the thing about this club is that we have got where we are by all pulling in the same direction.  that s happened for however long i ve been here and we don t want people taking sides.
sport,kenyon denies robben barca return chelsea chief executive peter kenyon has played down reports that arjen robben will return for the champions league match against barcelona.   he s been responding well to treatment and started running on friday  but we ll have to wait and see   he told bbc five live s sportsweek.  we re looking to getting him back as soon as possible  but he ll be back when it s right for him and for us.  there s no plans at the moment around the barcelona game.  his comments contradict those of chiropractor jean pierre meersseman who treated the dutchman after he fractured his foot at the start of february. robben had been expected to be out for six weeks  but meersseman hinted that the winger could be fit for the vital stamford bridge game on 8 march.  i hope he can be back and i will try to help him make that happen   meersseman told the mail on sunday.  i put everything right with arjen s foot the last time i saw him 12 days ago. it was an obvious correction and easy to perform.  i know he was pleased with what i did and now that he is running again. i am due to see him one more time again in the next few days.  meersseman is the medical co-ordinator at italian side ac milan.
politics,new  yob  targets to be unveiled fifty new areas getting special help to fight anti-social behaviour in england and wales will be named on thursday.  ten areas have already had access to special prosecutors and local experts and the government is now expanding the crackdown to more towns and cities. details of how many anti-social behaviour orders (asbos) were used in the last year are also being published. labour sees nuisance behaviour as a key election issue but critics claim the record is at best patchy. a year ago  ministers launched their anti-social behaviour plan and thursday s figures offer a progress check. they will say that in the past year more than 2 600 anti-social behaviour orders were issued by the courts - more than double the total used in the previous four years.  police have also closed 150 crack houses and issued more than 400 dispersal orders  breaking up groups of youths in public places. the 50 new pilot areas to get special attention will also receive extra government funding. exeter and cardiff are among cities who have voiced interest in being involved.  prime minister tony blair is also expected to announce new measures to strengthen the use of asbos and fixed penalty notices. there are still concerns that some areas of the country are not using the powers properly.  he is expected to say that the new figures were heartening but he would not rest until similar action was taken in all areas of the country where it was needed.  we have not defeated this problem by any means  but shown together what can be done   he will say. mr blair this week defended the shake-up of the licensing laws  saying it was right to focus on troublemakers rather than treating everybody as a potential drunken nuisance.  ministers also boast of record police numbers and are speeding up plans to put in place 25 000 community support officers (csos). but researchers from leeds university warned that csos could undermine traditional bonds between police officers and communities. more work needed to be done on clarifying the role of different agencies and how they linked together before csos  they argued in a the study. critics of the government say it has announced more than 20 initiatives to tackle nuisance behaviour when the real focus should be on good policing. home office minister hazel blears also revealed this week that  about a third  of asbos were breached - with some people jailed and others not.
politics,ukip outspent labour on eu poll the uk independence party outspent both labour and the liberal democrats in the european elections  new figures show.  ukip  which campaigned on a slogan of  say no to europe   spent £2.36m on the campaign - second only to the conservatives  £3.13m. the campaign took ukip into third place with an extra 10 meps. labour s campaign cost £1.7m  the lib dems  £1.19m and the greens  £404 000  according to figures revealed by the electoral commission on wednesday. much of the ukip funding came from yorkshire millionaire sir paul sykes  who helped bankroll the party s billboard campaign. critics have accused the party of effectively buying votes. but a ukip spokesman said labour and the conservatives had spent £10m between them on the last general election.  with the advantages of public money the others have  the only way the smaller parties can get their message across is by buying the advertising space   he added.
politics,royal couple watch nation s mood prince charles and camilla parker bowles are awaiting the nation s reaction after announcing they are to be married on 8 april.  mrs parker bowles will take the title hrh duchess of cornwall after a civil ceremony to be held at windsor castle. a daily telegraph poll of 1 313 people suggests two-thirds of britons support the couple s decision to marry. but only 40% think mrs parker bowles should become princess consort as planned after charles becomes king. some 47% believe she should have no title  while 7% think she should become queen.  the poll also found that the majority of britons would prefer the monarchy to miss a generation  with the queen handing the throne to her grandson prince william  22  on her death or abdication. on thursday night  prince charles  56  and mrs parker bowles  57  hosted a dinner at windsor castle  their first public appearance since announcing their engagement. mrs parker bowles said the prince went down on one knee to propose and added:  i m just coming down to earth.  she displayed her diamond engagement ring - a royal family heirloom - to reporters. charles said he and his wife-to-be were  absolutely delighted . their marriage will end years of speculation on a relationship which dates back to 1970.  the queen and duke of edinburgh said the news had made them  very happy . princes william and harry said they are  very happy  and wish the couple  all the luck in the future . the wedding will be a civil ceremony followed by a service of prayer and dedication in st george s chapel at which the archbishop of canterbury  dr rowan williams  will preside.  the marriage is likely to be a sensitive issue because mrs parker bowles is divorced and her former husband is still alive. if he became king  charles would be the supreme governor of the church of england and some anglicans remain opposed to the remarriage of divorcees.  his divorce from diana and the disappointment the country felt over how diana had been treated... opened up a sense of disillusionment with [prince charles]   said ros coward  who wrote the authorised biography of diana  princess of wales. the archbishop of canterbury said:  i am pleased that prince charles and mrs camilla parker bowles have decided to take this important step.  tony blair said he was  delighted  for the couple and offered his congratulations  as did conservative leader michael howard and liberal democrat leader charles kennedy. australia s prime minister john howard also offered his congratulations  adding that their decision to marry was a  sensible and a good thing . mrs parker bowles has joined the prince at numerous engagements in recent years - mostly at evening events for the prince s trust. clarence house staff were at pains to point out that she attended these events in a private capacity.
politics,kilroy-silk attacked with slurry euro mp robert kilroy-silk has had a bucket of farm slurry thrown over him by a protester in manchester.  the uk independence party member was arriving for a bbc radio show when the attacker emerged from behind a bush. fellow guest ruth kelly mp was also hit by the slurry. mr kilroy-silk said the man  who later disappeared  claimed he was  doing it in the name of islam . in january  mr kilroy-silk quit his bbc one show for remarks he made about arabs  who he called  suicide bombers .  mr kilroy-silk had already been taken off air by bbc bosses for the comments  in which he also described arabs as  limb-amputators  women repressors . the remarks prompted outrage among muslim groups. the slurry attack took place on friday as mr kilroy-silk and ms kelly  a cabinet office minister and bolton west mp  arrived at manchester high school for girls for the recording of bbc radio 4 s any questions.  the police were called but the attacker had disappeared by the time officers arrived. they are treating the incident as assault. the programme s host  jonathan dimbleby  later told the audience the mep had been covered from  head to toe . mr kilroy-silk was still able appear to appear on the show after being loaned a change of clothes.  he told reporters he was  very angry  and planned to press charges if his attacker was caught. he said the man shouted:  you ve offended my religion  i m doing this in the name of islam.   as i started to turn round a guy tipped a bucket of farmyard muck over me and then threw the rest of it over me and the car   mr kilroy-silk said.  i was totally covered  it was all through my clothes  and it stank to high heaven. it went all inside the car and splattered ruth kelly.  a bbc spokesman said:  he took his seat as jonathan dimbleby was introducing the show. fortunately someone at the school had a change of clothes to let him have.  greater manchester police said people near mr kilroy-silk had also been hit by the waste. officers took statements at the scene  but no arrests have been made. police say the suspect ran off after towards wilmslow road after committing the offence but is believed to have been driving a red vauxhall corsa earlier. the suspect is described as white  aged 30 to 40  with a ginger beard. police want to hear from anyone who has any information.  mr kilroy-silk  an mep for the east midlands  resigned the uk independence party whip in the european parliament in october  after criticising ukip and stating his ambition to be leader. however  he remains a member of the party. he said on friday he hoped to be elected party leader before christmas.  i think that is sufficient time for us to put in process what is necessary... in time for us to fight and have a significant impact upon the general election.  but a ukip spokesman said that would be impossible under the party s constitution  which requires 70 days before any leadership ballot can take place.
sport,radcliffe yet to answer gb call paula radcliffe has been granted extra time to decide whether to compete in the world cross-country championships.  the 31-year-old is concerned the event  which starts on 19 march in france  could upset her preparations for the london marathon on 17 april.  there is no question that paula would be a huge asset to the gb team   said zara hyde peters of uk athletics.  but she is working out whether she can accommodate the worlds without too much compromise in her marathon training.  radcliffe must make a decision by tuesday - the deadline for team nominations. british team member hayley yelling said the team would understand if radcliffe opted out of the event.  it would be fantastic to have paula in the team   said the european cross-country champion.  but you have to remember that athletics is basically an individual sport and anything achieved for the team is a bonus.  she is not messing us around. we all understand the problem.  radcliffe was world cross-country champion in 2001 and 2002 but missed last year s event because of injury. in her absence  the gb team won bronze in brussels.
sport,all black magic: new zealand rugby playing colours:  all black  the haka and more!  the all blacks  charles john munro discovered rugby at london s christ college  and on his return to nelson he staged new zealand s first game. nelson town met nelson college on 14 may  1870  the town triumphing by two goals to nil  instigating a game that would become a national obsession and come to dominate the country s sporting passions. the game appealed to the kiwi psyche and quickly spread  the native maoris finding a particular empathy with the sport s warrior ethos. in 1888 a british team led by ae stoddart toured new zealand and australia  and soon after a maori named joe warbrick and an english ex-pat called thomas eyton decided to gather a combined new zealand team.  twenty-two maori and four  pakiha  formed the  new zealand native team   who played a total of 107 matches in new zealand  australia and the uk. the integration of white and maori was a reflecion of enlightened new zealand rugby and society  even if the british press were somewhat mystified by the pre-match tradition of the maori war dance  the haka! the other great symbol of new zealand rugby  the all black kit with the silver fern on the breast  was proposed by tom ellison at the first annual meeting of the new zealand rugby football union in 1893. new zealand played their first international against australia in 1903  the kiwis triumphing 22-3 in sydney  and the following year an official british touring team came to new zealand for the first time. the tourists had gone through australia undefeated but their captain  david revell bedell-sivright  created animosity in new zealand with his patronising attitude. the kiwis shocked the rugby world with a 9-3 triumph in wellington  sparking great celebrations across the country  but bedell-sivright churlishly suggested that the victors would have no chance when they visited the uk.  their opportunity to prove him wrong came in 1905 with the first official new zealand tour to europe. the tourists won their early games with a quick-thinking  inventive approach  but press criticism began to grow over their 2-3-2 scrum formation that left a  roving  forward free to disrupt opposition attacks. the tactic was effective  two late tries seeing the kiwis to a 12-7 win over scotland  before ireland were despatched 15-0 in dublin. a huge crowd at crystal palace convulsed with laughter at the sight of the haka - but the smiles were soon wiped from their faces when the tourists ran in five tries in a 15-0 hammering of england. new zealand headed to wales to meet a country in the midst of its first  golden age   and the encounter would be the first in a series of controversial clashes between the sides. an excellent try on the left wing by teddy morgan sealed a 3-0 win in a hard-fought encounter at cardiff arms park  but post-match talk was dominated by a bob deans try that was ruled out by scottish referee john dallas. dallas said that deans was tackled short  but the kiwi said he was dragged back into the field of play after grounding a try - on his death-bed three years later he exclaimed:  i did score that try in cardiff.   four of the 1905 all blacks went over to the newly formed  all golds  rugby league side soon after the tour  but new zealand were strong enough to crush an anglo-welsh touring team in 1908. the first south africa tour of new zealand in 1921 saw honours shared in a three-test series  starting the greatest rivalry in rugby - and the long-running controversy between the countries over the all blacks  inclusion of maori players. the awesome 1924-5 all black tourists became known as  the invincibles  after winning all 30 of their games in france  britain and ireland  including a crushing 19-0 victory over wales at st helen s. despite their success  the all blacks  2-3-2 scrum formation left them somewhat short of possession at times  and the flaws were exploited by the springboks in south africa in 1928. employing the modern 3-4-1 scrum line-up against the new zealand  rover  system for the first time  south african teams defeated the all blacks in five games and the test series was drawn two-all. the controversial new zealand scrum method finally disappeared after the 1930 lions tour (a series won 3-1 by new zealand)  the lions manager describing the tactic as  cheating   prompting the international rugby board to rule that three men had to pack down in the front row of the scrum.  the all blacks  1935 european tour started inauspiciously with an 11-3 loss to a swansea side inspired by teenage  schoolboy half-backs hayden tanner and willie davies. a thrilling test at cardiff arms park went to wales 13-12  although the winning try from geoffrey rees-jones was controversial following an illegal claude davey tackle in the build-up. new zealand s next visit to wales in 1953 proved difficult as they lost 8-3 to cardiff and drew 6-6 at swansea. the all blacks were on top in the test with wales at the arms park  but the teams were locked at 8-8 when a clem thomas cross kick was gathered by ken jones for a famous  match-winning try. the tourists made some amends with wins over the other home nations  before a 19-5 success over the barbarians in an arms park thriller. new zealand built from that tour  and by the time they returned in 1963-4 they were undoubtedly the leading side in the world.  that made the shock all the greater when a drop goal by student john uzzell gave newport an unlikely 3-0 win over the tourists at rodney parade. wilson whinneray s side rallied to beat wales 6-0  their first win at the arms park in four attempts  and went unbeaten through the rest of the tour  but when they returned home the first question put to them was:  what happened in newport   the only blemish on the record of the awesome 1967 tourists was a draw with east wales  as they beat the full wales team 13-6 in cardiff to take the lead in the series between the countries for the first time. that lead was increased with two comfortable wins for the home side in new zealand in 1969  the first time wales had toured the country as an independent team.  a ferocious game at the arms park in 1972 was edged 19-16 by the all blacks  a measure of revenge for the defeat inflicted on new zealand by the carwyn james-inspired lions of 1971.  james guided llanelli to a famous 9-3 win over the tourists at stradey park  though  and in the final game of the tour the barbarians defeated the all blacks 23-11 in cardiff in a game regarded by many as the greatest ever played. new zealand defeated a wales xv 12-3 at the arms park in a non-cap game in 1974  but it was the 1978 game in cardiff that would reignite the history of controversy between the two countries.  wales were leading 12-10 with one minute left when andy haden flew to the floor from a line-out. television pictures clearly showed that he dived  but english referee roger quittenton was fooled and awarded a penalty  duly converted by brian mckechnie for a 13-12 win. since that infamous game  the competition has largely left wales v new zealand fixtures as the men in red have slipped from the pinnacle of the world game. a crushing 23-3 win for new zealand in cardiff in the welsh rugby union s 1980 centenary game was a sign of things to come. the new professionalism in the southern hemisphere game that had left europe behind was shown as the all blacks swatted wales aside 49-6 in brisbane in the semi-final of the inaugural world cup. the kiwis went on to claim the cup  and would inflict further misery on wales on their ill-fated 1988 tour of new zealand.  a young  talented wales side left britain full of confidence as triple crown winners  but one of the greatest ever new zealand teams demolished them 52-3 and 54-9. after also taking some fearful beatings in the provincial games  wales captain jonathan davies returned home calling for urgent change in the national game  but as his views were ignored he - along with a generation of wales  best players - chose to head north to rugby league.  a 34-9 win in cardiff followed for new zealand in 1989  and at the 1995 world cup wales  big talk was made to look embarrassing as the all blacks eased to victory in johannesburg. a crushing 42-7 kiwi triumph in wembley followed in 1997  and as wales  misery increased they turned to new zealand for their salvation in the shape of coaches graham henry and steve hansen. there was a temporary resurgence in the welsh game  but when an experimental new zealand side came to cardiff s new millennium stadium in 2002 they left with a 43-17 victory.  a bruising 55-3 defeat followed for wales in hamilton in 2003 as hansen built towards the world cup  but in australia it was a remarkable performance against the all blacks that gave his side renewed hope. wales were given no chance going into the game  but in the course of the match they rediscovered the value of attacking flair to lead 37-33 early in the second half. new zealand rallied to a 53-37 win  but the style shown by wales has been used as an inspiration as they look to a better future. they now face an all blacks team led by henry and hansen  coming to europe with a weakened squad at the end of a long season. an encouraging display against south africa has inspired a confident wales camp to believe they can claim their first win over the men in black for over 50 years. they have a chance  but clearly history is not on their side.
