category,doc_title
sport,wales silent on grand slam talk rhys williams says wales are still not thinking of winning the grand slam despite a third six nations win.   that s the last thing on our minds at the moment   said williams  a second- half replacement in saturday s 24-18 win over france in paris.  we all realise how difficult a task it is to go up to scotland and beat them.  we ve come unstuck there a couple of times recently so our focus is on that game and we ll worry about ireland hopefully after we ve beaten scotland.  with captain gareth thomas ruled out of the rest of the campaign with a broken thumb  williams is vying for his first start in the championship so far.  kevin morgan is probably favourite to replace thomas at full-back  leaving williams and hal luscombe to battle for the right wing berth. a hamstring injury denied luscombe the opportunity to make a third successive start  but the dragons winger is expected to be fit for the trip to murrayfield on 13 march. hooker robin mcbryde is doubtful after picking up a knee injury in paris  but centre sonny parker and flanker colin charvis are set to recover from injury to be in contention for selection. said wales assistant coach scott johnson:  they ve worked through the weekend and the reports are a bit more positive.  so we re getting a couple back and that adds to the depth of the squad.  scotland secured their first win of the campaign on saturday by grinding out an 18-10 win over italy.  matt williams  side has shown little in attack  but johnson insisted the scots will be difficult opposition to break down.  italy are really brave opposition and sometimes it s very hard to win   he said.  so an ugly win can be just as effective as a 30 or 40 point victory.  scotland are a hard side and very underrated so we re not taking anything for granted.  we re not basking in the glory of winning our first three games. we ve got to be diligent in our preparation.  that s my job and we ve got to make sure we re focused.
sport,ireland 21-19 argentina an injury-time dropped goal by ronan o gara stole victory for ireland from underneath the noses of argentina at lansdowne road on saturday.  o gara kicked all of ireland s points  with two dropped goals and five penalties  to give the home side a 100% record in their autumn internationals. an impressive argentina appeared in control until the dying seconds. the pumas shocked the irish early on with a try from federico aramburu  and felipe contepomi kicked 14 points. the well-drilled and sharper pumas out-played and out-thought ireland in the early stages. indiscipline allowed argentina s leinster fly-half contepomi to open the scoring in the third minute with a straightforward penalty. he was on the mark again two minutes later when argentina shocked a ragged ireland with the first try of the game. ireland turned the ball over and manuel contepomi broke through an unstructured defence before feeding his midfield partner aramburu to sprint in under the posts. o gara finally got ireland on the board with a dropped goal in the ninth minute only for contepomi to rifle over his second penalty two minutes later. playing into a strong wind and rain  ireland continued to come second best in tight situations  and turnovers began to mount up against a rugged defence. o gara managed to land his second penalty in the 36th minute  but once again contepomi replied in kind four minutes into first-half injury time. the second-half started as the first had ended. o gara rifled over another penalty in the 45th minute  but contepomi matched it three minutes later. the upper-body strength of the pumas never allowed ireland to take control up front  while the three-quarters had no space to manoeuvre. ireland had to rely on o gara s boot to keep in touch rather than any contrived running plays. the munsterman landed two more penalties - one of them from 48 metres - to bring his team to within four points with 13 minutes on the clock remaining. and ireland s chance came when argentina s number eight gonzalo longo was yellow carded with six minutes to go for an offence in the line-out. o gara made no mistake as he rifled over his fifth penalty to set up a tense final few minutes. but ireland showed great composure to get themselves into a position to allow o gara to thump over a massive drop goal to complete a tremendous  if fortuitous  comeback.
sport,wenger signs new deal arsenal manager arsene wenger has signed a new contract to stay at the club until may 2008.  wenger has ended speculation about his future by agreeing a long-term contract that takes him beyond the opening of arsenal s new stadium in two years. he said:  signing a new contract just rubber-stamps my desire to take this club forward and fulfil my ambitions.  i still have so much to achieve and my target is to drive this club on. these are exciting times for arsenal.   the 55-year-old frenchman told arsenal s website www.arsenal.com:  my intention has always been clear. i love this club and am very happy here.  wenger has won the title and the fa cup three times each during his reign. chairman peter hill-wood said:  we are absolutely delighted that arsene has signed an extension to his contract.  since his arrival in 1996  he has revolutionised the club both on and off the pitch.  as well as the six major honours he s won during his time here  arsene has been a leading influence behind all the major initiatives at the club including the construction of our new training centre and also our new stadium.   the club has continued to reap the benefits of arsene s natural eye for unearthing footballing talent.  we currently have a fantastic crop of young players coming through the ranks together with a number of world-class players who are playing a wonderful brand of football.  meanwhile  arsenal director danny fiszman is looking for wenger to stay beyond 2008.  when we come towards the end of his contract we will both review the situation. i m sure we will want him to stay on and i hope he will too   said fiszman.
sport,hantuchova in dubai last eight daniela hantuchova moved into the quarter-finals of the dubai open  after beating elene likhotseva of russia 7-5 6-4  and now faces serena williams.  australian open champion williams survived an early scare to beat russia s elena bovina 1-6 6-1 6-4. world number one lindsay davenport and anastasia myskina also progressed. davenport defeated china s jie zheng 6-2 7-5  while french open champion myskina sailed through after her opponent marion bartoli retired hurt. american davenport will now face fellow former wimbledon champion  conchita martinez of spain  who ousted seventh-seeded nathalie dechy of france 6-1 6-2. myskina will face eighth-seed patty schnyder from switzerland  who defeated china s li na 6-3 7-6 (10-8). the other quarter final pits wild card sania mirza of india against jelena jankovic of serbia and montenegro  who both won on tuesday.  before her meeting with martinez  davenport believes there is some room for improvement in her game.  i started well and finished well  but played some so-so games in the middle   she said. williams was also far from content.  i don t know what i was doing there   she said.  it was really windy and i hadn t played in the wind. all my shots were going out of here.  but hantuchova is in upbeat mood ahead of her clash with the younger williams sister  who was handed a first-round bye.  i feel i have an advantage (over serena) because i have already played two matches on these courts   she said.  it is a difficult court to play on. very fast and sometimes you feel you have no control over the ball.
sport,melzer shocks agassi in san jose second seed andre agassi suffered a comprehensive defeat by jurgen melzer in the quarter-finals of the sap open.  agassi was often bamboozled by the austrian s drop shots in san jose  losing 6-3 6-1. defending champion and top seed andy roddick rallied to beat sweden s thomas enqvist 3-6 7-6 (8-6) 7-5. but unseeded cyril saulnier beat the fourth seed vincent spadea 6-2 6-4 and tommy haas overcame eighth seed max mirnyi 6-7 (2-7) 7-6 (7-3) 6-2. melzer has now beaten agassi in two of their three meetings.   i had a good game plan and i executed it perfectly   he said.  it s always tough to come out to play andre.  i didn t want him to play his game. he makes you run like a dog all over the court.  and agassi  who was more than matched for power by his opponent s two-handed backhand  said melzer was an example of several players on the tour willing to take their chances against him.  a lot more guys are capable of it now   said the american.  he played much better than me. that s what he did both times.  i had opportunities to loosen myself up   agassi added.  but i didn t convert on the big points.
sport,hewitt overcomes wobble in sydney lleyton hewitt gave himself the perfect preparation for next week s australian open with victory over ivo minar in the final of the sydney international.  the defending champion brushed aside the czech qualifier 7-5 6-0. the australian world number three strolled to the first five games of the match but was shocked as minar won the next five. the top seed was rattled but recovered to close out the set and raced to victory in exactly an hour.  it was a strange match . . . momentum swings   said hewitt.  i felt like i came out of the blocks extremely well  but then he loosened up a bit.  when he got back to 5-5  i had to try to settle down and take it up a notch  and i was able to do that.   hewitt has now lifted the sydney title four times in the last six years.  it just keeps getting better and better every year   hewitt said.  i ve only played this tournament four times and i ve won it four times.  hewitt went into the final as a short-priced favourite to clinch his 24th career title after dropping only one set all week. he is set to meet frenchman arnaud clement in the first round of the australian open. minar  ranked 158th in the world  was forced to pull out of the australian open qualifying draw to play in his first atp final.  for me  this was a big success   said the 20-year-old.  i was so nervous last night i couldn t sleep. i ve never played a top-10 player before.  i wanted to play qualifying in melbourne  but it s saturday and i m still here. but this is a main draw and i need the points and the money.  alicia molik takes on samantha stosur in an all-australian women s final later on saturday.
sport,serena becomes world number two serena williams has moved up five places to second in the world rankings after her australian open win.  williams won her first grand slam title since 2003 with victory over lindsay davenport  the world number one. men s champion marat safin remains fourth in the atp rankings while beaten finalist lleyton hewitt replaces andy roddick as world number two. roger federer retains top spot  but safin has overtaken hewitt to become the new leader of the champions race. alicia molik  who lost a three-set thriller against davenport in the quarter-finals  is in the women s top 10 for the first time in her career. her rise means australia have a player in the top 10 of the men s and women s rankings for the first time in 21 years. and britain s elena baltacha  who qualified and then reached the third round  has risen to 120 in the world - a leap of 65 places and her highest ranking yet.
sport,ferguson urges henry punishment sir alex ferguson has called on the football association to punish arsenal s thierry henry for an incident involving gabriel heinze.  ferguson believes henry deliberately caught heinze on the head with his knee during united s controversial win. the united boss said it was worse than ruud van nistelrooy s foul on ashley cole for which he got a three-game ban.  we shall present it to the fa and see what they do. the tackle on heinze was terrible   he said. clubs are permitted to ask the fa to examine specific incidents but information is expected to be provided within 48 hours of the game. the clash occurred moments before half-time when a freddie ljungberg challenge left heinze on the ground on the left touchline. henry  following the ball  attempted to hurdle the argentine but his knee collided with the back of heinze s head.  the striker protested his innocence - and referee mike riley deemed the collision accidental. ferguson was also upset by arsenal s overall discipline during the heated encounter between the two arch-rivals and praised his own side s behaviour.  edu produced a terrible tackle on scholes that was a potential leg-breaker   he said.  there were 24 fouls in the game by arsenal  seven on heinze  five on ronaldo  six by vieira - and it was only his sixth foul that got him booked. phil neville got booked for his first challenge.  i am proud of my players for the way they handled that pressure.  we have always been good at being gracious in defeat. what happened on sunday overshadowed our achievement  but then they do it all the time  don t they
politics,tories outlining policing plans local communities would be asked to go to the polls to elect their own area police commissioner  under plans unveiled by the conservatives.  party leader michael howard said the new role would replace  inconspicuous  police authorities. he said the new office would not supersede the job of a chief constable. the lib dems said the plan could let extreme groups run policing  while labour criticised  extravagant  tory promises on policing.  responding to the plans  the chairman of the police federation of england and wales  which represents rank and file officers  said it was essential operational independence was retained.  jan berry said:  it is a service  not a political football to be kicked around every time an election approaches.  these plans could result in those with extreme political views dictating what actually happens on the ground   she warned. outlining his crime manifesto  mr howard said elected police commissioners would be more accountable than police authorities which are made up of local councillors and magistrates.  the commissioner will have the powers which existing police authorities have   he told bbc radio 4 s today programme.  the trouble is  and it s no reflection on the people who are on the police authority - they are good people - but hardly anyone knows who they are.  mr howard said the authorities were not  providing the local accountability that we want to see  and that elected police commissioners would be more visible.  critics fear the move could hand control of the police to single-issue campaigners who would ignore the needs of the wider community. lord harris  who sits on the executive of association of police authorities  said the plans seemed to suggest chief constables should be told what to do by a single politician.  that is overturning nearly 200 years of the way in which we have organised policing in this country to avoid the politicisation of policing decisions   he said.  liberal democrat home affairs spokesman mark oaten said the plan was dangerous and  could create conflict between chief constables and elected officials . mr oaten said local people had too little control over policing but a far better solution would be for elected councillors to draw up a  minimum policing guarantee  with their chief constables. a labour party spokesman criticised michael howard s record  saying police numbers had fallen by 1 132 when he was home secretary. he said:  today the tories are making more extravagant promises on the police without making clear how they would pay for them  other than through fantasy savings to the asylum system.  the tories insists the commissioner role would not be like that of an american sheriff. other tory law and order plans include building more prisons and making criminals serve full jail sentences.
politics,howard pitches for uk ethnic vote michael howard is to make a pitch for britain s ethnic vote urging people who feel  taken for granted  by tony blair to vote conservative.  he will say conservatives  share the same values  as the uk s minorities. and that he wants to build a  better britain  where everyone  whatever the colour of their skin or religion  can  make the most of their talents . but the tory leader will argue against positive discrimination saying it is  outdated and unjust .   it sets family against family and it leads ethnic communities to doubt their own abilities   he will argue. mr howard - himself the son of immigrants - will acknowledge that racial discrimination still exists in the uk.  people from ethnic communities  for example  still earn less than their white counterparts   he will say before arguing the answer to helping everyone to get on was  free enterprise  free trade  free speech . the tory leader will also call for religious tolerance arguing that hindus and sikhs as well as muslims got  caught in the downdraft of islamaphobia which was one of the terrible side effects of 9/11 .  mr howard will make his speech during a visit to support tory parliamentary hopefuls robert light and sayeeda warsi -  the first british muslim woman  selected to run for mp as a conservative candidate. he will attack labour s record in government over issues such as tax and he will set out tory plans for an immigration quota to be set by mps. mr howard will also attack the lib dems for wanting to abolish faith schools  introduce compulsory sex education from the age of seven  and  give contraceptives out in schools from the age of 11 .  so i say to all those people from ethnic minorities who feel mr blair and the liberal democrats take their votes for granted - come join us   he will say. lib dem president simon hughes branded mr howard  arrogant and wrong  for claiming the tories were the  natural party  for britain s ethnic minorities.  given the tories  considerably reduced support in urban areas  where many black and asian britons live  during their time in power  the evidence simply does not support his claims that the conservatives are the party for these communities   he said.
politics,clarke to press on with id cards new home secretary charles clarke has vowed to plough on with plans for id cards despite a call for him to  pause for thought  from charles kennedy.  the lib dem leader said david blunkett s resignation was a  good opportunity  to question whether the legislation was necessary. but mr clarke said he had supported the plans when mr blunkett argued for them in cabinet and he supported them now.  id cards are a means to creating a more secure society   he said. mr clarke acknowledged how the measure was introduced remained a matter for debate but he said legislation had already been  significantly influenced  by the recommendations of the commons  home affairs committee.  the issue would be debated in parliament next monday as scheduled he insisted. earlier mr kennedy  whose party opposes the id cards plan as  deeply flawed  said with christmas coming up the new home secretary had time to think again. he told bbc radio 4 s today programme that mr clarke had been reported to be less enthusiastic about id cards than his predecessors.  wouldn t this be a good opportunity for a new home secretary  a new broom  to sweep clean in this respect and why do we need this legislation in the first place   he asked. earlier this week the tories announced they would back the government s plans although michael howard was forced to deny the shadow cabinet was split over its decision.  they had decided to support the plans as the police said they would help fight terror  crime and illegal immigration. among those reported to have serious reservations over the strategy were senior shadow cabinet members david davis  oliver letwin and tim yeo. the chairman of the bar council  guy mansfield qc has warned there is a real risk that people on the  margins of society  would be driven into the hands of extremists.  what is going to happen to young asian men when there has been a bomb gone off somewhere  they are going to be stopped. if they haven t [id cards] they are going to be detained.   the home office says people will pay £85 for a passport and id card together or a undecided fee for a separate id card. the first cards would be issued in 2008 and when he was introducing the bill  mr blunkett suggested parliament could decide in 2011 or 2012 whether to make it compulsory for everybody to own the cards  although not to carry them. the new bill will also create new criminal offences on the possession of false identity documents. and there will be civil penalties including a fine of up to £1 000 fine for people who fail to say they have moved house or changed other details and of up to £2 500 for failing to sign up if the cards become compulsory. the scheme will be overseen by a new independent watchdog.
politics,boris opposes mayor apology ken livingstone should  stick to his guns  and not apologise for his  nazi  comment to a jewish reporter  tory mp boris johnson has insisted.  mr johnson also claimed tony blair s intervention in the row was  an attempt to reassure jewish voters . london mayor mr livingstone says he is  standing by  his remarks which likened an evening standard journalist to a  concentration camp guard . but the prime minister says it is time for mr livingstone to say sorry.  labour s mr livingstone has said his comments may have been offensive but were not racist  and said earlier this week he would not apologise even if mr blair asked. later the prime minister said:  a lot of us in politics get angry with journalists from time to time  but in the circumstances  and to the journalist because he was a jewish journalist  yes  he should apologise.   however  mr johnson  who was forced to apologise last year for an article in the magazine he edits about liverpudlians grieving over the death of british hostage ken bigley  said mr blair  should butt out of  the row.  i don t see why the prime minister has to get involved in this   the spectator editor told bbc radio 4 s today programme.  it s a dispute between ken livingstone and a reporter on the evening standard.  mr johnson  mp for henley-on-thames  oxfordshire  said he suspected labour was now trying to reassure jewish voters  because of this curious way in which labour seems to be trying to curry favour with disillusioned muslim voters who may be disillusioned about the war .   ken doesn t think he s got anything to say sorry for and if that s really his feeling  then i think that he should stick to his guns   he said. mr johnson apologised last october for perpetuating an  outdated stereotype  of liverpool in the leader article on the death of mr bigley. the article in the magazine suggested grieving liverpudlians were wallowing in their victim status. it also attributed blame to drunken liverpool football fans for the 1989 hillsborough disaster in which 96 died. mr johnson told today:  it s perfectly true that i got into the grovelling game myself and when i apologised there were some things that i felt i ought to say sorry for ... there were also other things i didn t think i should apologise for   he said.  but here s old ken - he s been crass  he s been insensitive and thuggish and brutal in his language - but i don t think actually if you read what he said  although it was extraordinary and rude  i don t think he was actually anti-semitic.
